{
  "version": 2,
  "status": "refused",
  "applied": false,
  "review_bound": false,
  "review_binding_status": "stale",
  "refusal": {
    "kind": "reviewed_preview_evidence",
    "message": "merge apply refused: reviewed preview evidence no longer matches the exact current apply preview",
    "axes": [
      "primary_head",
      "primary_index",
      "primary_worktree",
      "source_head",
      "source_identity",
      "candidate_snapshot",
      "candidate_diff",
      "base_preview"
    ],
    "next_safe_operation": "run_merge_preview_again_with_the_same_options"
  }
}
